{
  "$schema": "https://json-schema.org/draft/2020-12/schema",
  "type": "object",
  "required": [
    "profiles",
    "tools",
    "files",
    "rules"
  ],
  "properties": {
    "$schema": {
      "type": "string"
    },
    "profiles": {
      "type": "object"
    },
    "tools": {
      "type": "array"
    },
    "files": {
      "type": "array"
    },
    "rules": {
      "type": "object"
    }
  }
}