{
  "$schema": "./schema/spec.schema.json",
  "profiles": {
    "minimal": {
      "description": "Minimal cross-platform base needed to run, edit, and validate the dotfiles system.",
      "tools": [
        "git",
        "bash",
        "jq",
        "shellcheck",
        "gh",
        "wezterm",
        "nvim"
      ]
    },
    "developer": {
      "description": "Extended cross-platform developer tooling.",
      "extends": [
        "minimal"
      ],
      "tools": [
        "opencode",
        "keepassxc",
        "ripgrep",
        "fd",
        "eza"
      ]
    }
  },
  "tools": [
    {
      "name": "git",
      "state": "active",
      "commands": [
        "git"
      ],
      "platforms": [
        "windows",
        "debian",
        "arch"
      ],
      "installPreference": "platform",
      "packages": {
        "debian": "git",
        "arch": "git",
        "windows": "Git.Git"
      }
    },
    {
      "name": "bash",
      "state": "active",
      "commands": [
        "bash"
      ],
      "platforms": [
        "windows",
        "debian",
        "arch"
      ],
      "installPreference": "platform",
      "packages": {
        "debian": "bash",
        "arch": "bash",
        "windows": "Git.Git"
      }
    },
    {
      "name": "jq",
      "state": "active",
      "commands": [
        "jq"
      ],
      "platforms": [
        "windows",
        "debian",
        "arch"
      ],
      "installPreference": "platform",
      "packages": {
        "debian": "jq",
        "arch": "jq",
        "windows": "jqlang.jq"
      }
    },
    {
      "name": "shellcheck",
      "state": "active",
      "commands": [
        "shellcheck"
      ],
      "platforms": [
        "windows",
        "debian",
        "arch"
      ],
      "installPreference": "platform",
      "packages": {
        "debian": "shellcheck",
        "arch": "shellcheck",
        "windows": "koalaman.shellcheck"
      }
    },
    {
      "name": "gh",
      "state": "active",
      "commands": [
        "gh"
      ],
      "platforms": [
        "windows",
        "debian",
        "arch"
      ],
      "installPreference": "platform",
      "packages": {
        "debian": "gh",
        "arch": "github-cli",
        "windows": "GitHub.cli"
      }
    },
    {
      "name": "wezterm",
      "state": "active",
      "commands": [
        "wezterm"
      ],
      "platforms": [
        "windows",
        "debian",
        "arch"
      ],
      "installPreference": "upstream",
      "upstream": {
        "debian": [
          "curl -fsSL https://apt.fury.io/wez/gpg.key | ${SUDO}gpg --dearmor -o /usr/share/keyrings/wezterm-fury.gpg",
          "printf 'deb [signed-by=/usr/share/keyrings/wezterm-fury.gpg] https://apt.fury.io/wez/ * *\\n' | ${SUDO}tee /etc/apt/sources.list.d/wezterm.list >/dev/null",
          "${SUDO}apt-get update",
          "${SUDO}apt-get install -y wezterm"
        ],
        "arch": [
          "${SUDO}pacman -S --noconfirm wezterm"
        ],
        "windows": [
          "winget install --id wez.wezterm --exact --source winget"
        ]
      }
    },
    {
      "name": "nvim",
      "state": "active",
      "commands": [
        "nvim"
      ],
      "platforms": [
        "windows",
        "debian",
        "arch"
      ],
      "installPreference": "upstream",
      "upstream": {
        "debian": [
          "curl -fL -o /tmp/nvim-linux-x86_64.tar.gz https://github.com/neovim/neovim/releases/latest/download/nvim-linux-x86_64.tar.gz",
          "${SUDO}rm -rf /opt/nvim-linux-x86_64",
          "${SUDO}tar -C /opt -xzf /tmp/nvim-linux-x86_64.tar.gz",
          "${SUDO}ln -sf /opt/nvim-linux-x86_64/bin/nvim /usr/local/bin/nvim",
          "rm -f /tmp/nvim-linux-x86_64.tar.gz"
        ],
        "arch": [
          "${SUDO}pacman -S --noconfirm neovim"
        ],
        "windows": [
          "winget install --id Neovim.Neovim --exact --source winget"
        ]
      }
    },
    {
      "name": "opencode",
      "state": "active",
      "commands": [
        "opencode"
      ],
      "platforms": [
        "windows",
        "debian",
        "arch"
      ],
      "installPreference": "upstream",
      "upstream": {
        "debian": [
          "curl -fsSL https://opencode.ai/install | bash"
        ],
        "arch": [
          "curl -fsSL https://opencode.ai/install | bash"
        ],
        "windows": [
          "winget install --id opencode.open --exact --source winget"
        ]
      }
    },
    {
      "name": "keepassxc",
      "state": "active",
      "commands": [
        "keepassxc"
      ],
      "platforms": [
        "windows",
        "debian",
        "arch"
      ],
      "installPreference": "platform",
      "packages": {
        "debian": "keepassxc",
        "arch": "keepassxc",
        "windows": "KeePassXCTeam.KeePassXC"
      }
    },
    {
      "name": "ripgrep",
      "state": "active",
      "commands": [
        "rg"
      ],
      "platforms": [
        "windows",
        "debian",
        "arch"
      ],
      "installPreference": "platform",
      "packages": {
        "debian": "ripgrep",
        "arch": "ripgrep",
        "windows": "BurntSushi.ripgrep.MSVC"
      }
    },
    {
      "name": "fd",
      "state": "active",
      "commands": [
        "fd",
        "fdfind"
      ],
      "platforms": [
        "windows",
        "debian",
        "arch"
      ],
      "installPreference": "platform",
      "packages": {
        "debian": "fd-find",
        "arch": "fd",
        "windows": "sharkdp.fd"
      }
    },
    {
      "name": "eza",
      "state": "active",
      "commands": [
        "eza"
      ],
      "platforms": [
        "windows",
        "debian",
        "arch"
      ],
      "installPreference": "platform",
      "packages": {
        "debian": "eza",
        "arch": "eza",
        "windows": "eza-community.eza"
      }
    }
  ],
  "files": [
    {
      "id": "nvim-init",
      "source": "config/nvim/init.lua",
      "targets": {
        "linux": "${XDG_CONFIG_HOME}/nvim/init.lua",
        "windows": "${HOME}/AppData/Local/nvim/init.lua"
      }
    },
    {
      "id": "shared-diagnose-skill",
      "source": "config/agents/skills/diagnose/SKILL.md",
      "targets": {
        "linux": "${HOME}/.agents/skills/diagnose/SKILL.md",
        "windows": "${HOME}/.agents/skills/diagnose/SKILL.md"
      },
      "xdgException": true,
      "reason": "Shared agent skill discovery convention is home-based."
    },
    {
      "id": "shared-dotfiles-skill",
      "source": "config/agents/skills/dotfiles/SKILL.md",
      "targets": {
        "linux": "${HOME}/.agents/skills/dotfiles/SKILL.md",
        "windows": "${HOME}/.agents/skills/dotfiles/SKILL.md"
      },
      "xdgException": true,
      "reason": "Shared agent skill discovery convention is home-based."
    },
    {
      "id": "shared-grill-me-skill",
      "source": "config/agents/skills/grill-me/SKILL.md",
      "targets": {
        "linux": "${HOME}/.agents/skills/grill-me/SKILL.md",
        "windows": "${HOME}/.agents/skills/grill-me/SKILL.md"
      },
      "xdgException": true,
      "reason": "Shared agent skill discovery convention is home-based."
    },
    {
      "id": "shared-grill-with-docs-skill",
      "source": "config/agents/skills/grill-with-docs/SKILL.md",
      "targets": {
        "linux": "${HOME}/.agents/skills/grill-with-docs/SKILL.md",
        "windows": "${HOME}/.agents/skills/grill-with-docs/SKILL.md"
      },
      "xdgException": true,
      "reason": "Shared agent skill discovery convention is home-based."
    },
    {
      "id": "shared-handoff-skill",
      "source": "config/agents/skills/handoff/SKILL.md",
      "targets": {
        "linux": "${HOME}/.agents/skills/handoff/SKILL.md",
        "windows": "${HOME}/.agents/skills/handoff/SKILL.md"
      },
      "xdgException": true,
      "reason": "Shared agent skill discovery convention is home-based."
    },
    {
      "id": "shared-improve-codebase-architecture-skill",
      "source": "config/agents/skills/improve-codebase-architecture/SKILL.md",
      "targets": {
        "linux": "${HOME}/.agents/skills/improve-codebase-architecture/SKILL.md",
        "windows": "${HOME}/.agents/skills/improve-codebase-architecture/SKILL.md"
      },
      "xdgException": true,
      "reason": "Shared agent skill discovery convention is home-based."
    },
    {
      "id": "shared-prototype-skill",
      "source": "config/agents/skills/prototype/SKILL.md",
      "targets": {
        "linux": "${HOME}/.agents/skills/prototype/SKILL.md",
        "windows": "${HOME}/.agents/skills/prototype/SKILL.md"
      },
      "xdgException": true,
      "reason": "Shared agent skill discovery convention is home-based."
    },
    {
      "id": "shared-setup-matt-pocock-skills-skill",
      "source": "config/agents/skills/setup-matt-pocock-skills/SKILL.md",
      "targets": {
        "linux": "${HOME}/.agents/skills/setup-matt-pocock-skills/SKILL.md",
        "windows": "${HOME}/.agents/skills/setup-matt-pocock-skills/SKILL.md"
      },
      "xdgException": true,
      "reason": "Shared agent skill discovery convention is home-based."
    },
    {
      "id": "shared-tdd-skill",
      "source": "config/agents/skills/tdd/SKILL.md",
      "targets": {
        "linux": "${HOME}/.agents/skills/tdd/SKILL.md",
        "windows": "${HOME}/.agents/skills/tdd/SKILL.md"
      },
      "xdgException": true,
      "reason": "Shared agent skill discovery convention is home-based."
    },
    {
      "id": "shared-to-issues-skill",
      "source": "config/agents/skills/to-issues/SKILL.md",
      "targets": {
        "linux": "${HOME}/.agents/skills/to-issues/SKILL.md",
        "windows": "${HOME}/.agents/skills/to-issues/SKILL.md"
      },
      "xdgException": true,
      "reason": "Shared agent skill discovery convention is home-based."
    },
    {
      "id": "shared-to-prd-skill",